reports/feature_importance.csv

feature,importance,rank
amount_last_1_hour,0.63725513,1
international_transaction,0.16420105,2
new_location,0.04231593,3
transaction_amount,0.041288752,4
payment_method,0.025769383,5
distance_from_home,0.018543104,6
log_transaction_amount,0.009158819,7
merchant_category,0.008918807,8
failed_transaction_count,0.008690416,9
amount_deviation_from_customer_average,0.008592489,10
authentication_method,0.00795223,11
transaction_velocity,0.007036304,12
failed_attempt_ratio,0.002864955,13
time_since_previous_transaction,0.0018116435,14
transactions_last_24_hours,0.0017557951,15
unusual_auth_flag,0.001665606,16
behavioral_risk_proxy,0.0014990211,17
login_attempts,0.001272266,18
transactions_last_1_hour,0.0006283324,19
device_type,0.0005823493,20
transaction_type,0.00055451103,21
transaction_day,0.0005321465,22
new_device,0.00044500595,23
transactions_last_10_minutes,0.00044466107,24
hour_cos,0.00042638808,25
hour_sin,0.00040942302,26
day_cos,0.0003791798,27
transaction_month,0.0003597806,28
day_sin,0.00034351248,29
average_transaction_amount,0.00033692928,30
velocity_surge_ratio,0.0003319562,31
transaction_frequency,0.00032394732,32
amount_to_balance_ratio,0.0003158796,33
weekend_transaction,0.00031039468,34
previous_transaction_amount,0.00030629578,35
amount_last_24_hours,0.0002978613,36
transaction_hour,0.00026360943,37
balance_drain_ratio,0.0002575653,38
customer_age,0.00025022522,39
account_age_days,0.00023746466,40
customer_transaction_count,0.00023658364,41
night_transaction,0.00023652706,42
customer_income,0.0002099449,43
amount_deviation_from_previous_transaction,0.00019779579,44
account_balance,0.00018998994,45

README.md

### Top 10 Feature Importance Ranking (XGBoost Gain)

1. `amount_last_1_hour` ($0.6373$)
2. `international_transaction` ($0.1642$)
3. `new_location` ($0.0423$)
4. `transaction_amount` ($0.0413$)
5. `payment_method` ($0.0258$)
6. `distance_from_home` ($0.0185$)
7. `log_transaction_amount` ($0.0092$)
8. `merchant_category` ($0.0089$)
9. `failed_transaction_count` ($0.0087$)
10. `amount_deviation_from_customer_average` ($0.0086$)